title,description,skill,link,img_url,label
Senior Software Architect (Linux - Edge Device),Siemens,"linux, python, troubleshooting, apache, coding, golang, training, legal, microsoft, building, debian, git, design, software development, subversion, delivery, manufacturing",https://www.kariyer.net//is-ilani/siemens-senior-software-architect-linux-edge-device-3495968,https://img-kariyer.mncdn.com/UploadFiles/Clients/Logolar/simko_logo.gif,it support technician
Expert Software Engineer,C Tech Bilişim Teknolojileri San. ve Tic. A.Ş.,"matlab, cuda",https://www.kariyer.net//is-ilani/c-tech-bilisim-teknolojileri-san-ve-tic-a-s-uzman-yazilim-muhendisi-3404184,https://img-kariyer.mncdn.com/UploadFiles/Clients/Logolar/ctech.png,data analyst
Expert Software Engineer,T Rupt Teknoloji,"python, django, postgresql, git, design",https://www.kariyer.net//is-ilani/t-rupt-teknoloji-uzman-yazilim-muhendisi-3478544,/_assets/img/firma-logosuz.png,data warehouse developer
Expert Software Engineer,CS TECH,"matlab, design",https://www.kariyer.net//is-ilani/cs-tech-uzman-yazilim-muhendisi-3485679,https://img-kariyer.mncdn.com/UploadFiles/Clients/Logolar/cs-tech.gif,data analyst
Interface Development Specialist,Gizli Firma,"mvc, html5, photoshop, css, design, seo, javascript",https://www.kariyer.net//is-ilani/gizli-firma-arayuz-gelistirme-uzmani-2015889,,digital marketing specialist
Senior Frontend Developer,Yukatech Bilişim A.Ş.,"css, git, html, gps",https://www.kariyer.net//is-ilani/yukatech-bilisim-a-s-senior-frontend-developer-3503978,https://img-kariyer.mncdn.com/UploadFiles/Clients/Logolar/254406_230061.jpg,front-end developer
Senior React Native Developer,Yukatech Bilişim A.Ş.,"git, gps",https://www.kariyer.net//is-ilani/yukatech-bilisim-a-s-senior-react-native-developer-3504513,https://img-kariyer.mncdn.com/UploadFiles/Clients/Logolar/254406_230061.jpg,web developer
Senior Software Engineer (Linux - Edge Device),Siemens,"linux, python, golang, legal, software development, design, manufacturing",https://www.kariyer.net//is-ilani/siemens-senior-software-engineer-linux-edge-device-3403266,https://img-kariyer.mncdn.com/UploadFiles/Clients/Logolar/1017_247932.jpg,software engineer
"Senior Full Stack Software Developer (Java,...",Siemens,"engineering, management, apache, reviews, data processing, legal, communications, building, research, git, design, java, software development, delivery",https://www.kariyer.net//is-ilani/siemens-senior-full-stack-software-developer-java-3367001,https://img-kariyer.mncdn.com/UploadFiles/Clients/Logolar/1017_247932.jpg,software engineer
"Mid-Level Full Stack Software Developer (Java,...",Siemens,"engineering, management, apache, reviews, data processing, legal, communications, research, energy, git, design, java, software development, delivery",https://www.kariyer.net//is-ilani/siemens-mid-level-full-stack-software-developer-java-3367000,https://img-kariyer.mncdn.com/UploadFiles/Clients/Logolar/1017_247932.jpg,software engineer
"Senior C#, PL/SQL Developer",DIGITURK,"oracle, microsoft",https://www.kariyer.net//is-ilani/digiturk-kidemli-c-pl-sql-gelistirme-uzmani-3059079,/_assets/img/firma-logosuz.png,data warehouse developer
Senior Software Specialist,Sürat Kargo,"mvc, microsoft",https://www.kariyer.net//is-ilani/surat-kargo-kidemli-yazilim-uzmani-2934088,https://img-kariyer.mncdn.com/UploadFiles/Clients/Logolar/276662_216392.jpg,data analyst
Senior Software Development Engineer C++...,Siemens,"legal, manufacturing",https://www.kariyer.net//is-ilani/siemens-senior-software-development-engineer-c-3489605,/_assets/img/firma-logosuz.png,software engineer
Software developing expert,Gizli Firma,"mvc, restful, microsoft sql server, microsoft, sql",https://www.kariyer.net//is-ilani/gizli-firma-yazilim-gelistirme-uzmani-3508518,,data warehouse developer
Senior Java Developer - Remote,LOGO YAZILIM SAN.VE TİC.A.Ş.,"git, xml, java, sql",https://www.kariyer.net//is-ilani/logo-yazilim-san-ve-tic-a-s-kidemli-java-yazilim-gelistirme-uzmani-remote-2340878,https://img-kariyer.mncdn.com/UploadFiles/Clients/Logolar/3066.gif,data warehouse developer
Senior Software Developer,Yurtiçi Kargo Servisi A.Ş.,"unix, oracle, postgresql, java, sql",https://www.kariyer.net//is-ilani/yurtici-kargo-servisi-a-s-kidemli-yazilim-gelistirme-uzmani-3153865,https://img-kariyer.mncdn.com/UploadFiles/Clients/Logolar/yurticikargo.png,data warehouse developer
.Net Core Developer,Algomedi Bilgi Teknolojileri,"medical, insurance, turkish",https://www.kariyer.net//is-ilani/algomedi-bilgi-teknolojileri--net-core-developer-3505190,https://img-kariyer.mncdn.com/UploadFiles/Clients/Logolar/321884_243051.jpg,data analyst
Full-Stack Developer (Net Core + Angular),Algomedi Bilgi Teknolojileri,"medical, insurance, turkish",https://www.kariyer.net//is-ilani/algomedi-bilgi-teknolojileri-full-stack-developer-net-core-angular-3505187,https://img-kariyer.mncdn.com/UploadFiles/Clients/Logolar/321884_243051.jpg,data analyst
Senior Software Developer,WTECHIN YAZILIM BİLİŞİM VE DANIŞMANLIK A. Ş.,"json, mvc, restful, ajax, bootstrap, html5, sql, javascript",https://www.kariyer.net//is-ilani/wtechin-yazilim-bilisim-ve-danismanlik-a-s-kidemli-yazilim-gelistirme-uzmani-3485946,https://img-kariyer.mncdn.com/UploadFiles/Clients/Logolar/320936_242216.jpg,data warehouse developer
Android Senior Software Developer,Verifone,"excel, engineering, management, coding, cryptography, software development, design, android, compliance, delivery",https://www.kariyer.net//is-ilani/verifone-android-senior-software-developer-3492845,https://img-kariyer.mncdn.com/UploadFiles/Clients/Logolar/verifone.gif,it auditor
Senior Software Developer,Industrial Application Software,"erp, sql, big data",https://www.kariyer.net//is-ilani/industrial-application-software-kidemli-yazilim-gelistirme-uzmani-3468787,https://img-kariyer.mncdn.com/UploadFiles/Clients/Logolar/1670_174261.jpg,data warehouse developer
Senior Android Developer,ETTS ELEKTRONİK TİC.TAHSİLAT SİST.SAN.VETİC.LTD.ŞTİ.,"git, android, swift",https://www.kariyer.net//is-ilani/etts-elektronik-tic-tahsilat-sist-san-vetic-ltd-st-senior-android-developer-3500311,/_assets/img/firma-logosuz.png,mobile app developer
Senior Software Developer (Backend),Konzek Teknoloji San. ve Tic.A.Ş,"engineering, unix, publishing, programming, artificial intelligence, redis, design, delivery, manufacturing",https://www.kariyer.net//is-ilani/konzek-teknoloji-san-ve-tic-a-s-senior-software-developer-backend-3492457,https://img-kariyer.mncdn.com/UploadFiles/Clients/Logolar/70587_199195.jpg,artificial intelligence specialist
Senior Software Developer (Frontend),Konzek Teknoloji San. ve Tic.A.Ş,"html, publishing, git, programming, artificial intelligence, typescript, software development, css, manufacturing",https://www.kariyer.net//is-ilani/konzek-teknoloji-san-ve-tic-a-s-senior-software-developer-frontend-3492453,https://img-kariyer.mncdn.com/UploadFiles/Clients/Logolar/70587_199195.jpg,front-end developer
Senior Software Developer - Hybrid,Logo Elektronik Ticaret Hizmetleri A.Ş.,"git, design, redis, elasticsearch",https://www.kariyer.net//is-ilani/logo-elektronik-ticaret-hizmetleri-a-s-kidemli-yazilim-gelistirme-uzmani-hybrid-3390320,https://img-kariyer.mncdn.com/UploadFiles/Clients/Logolar/3066.gif,data analyst
Senior Software Developer,Logo Yazılım San Ve Tic A.Ş.,"design, mvc, restful, erp, postgresql, git, delphi",https://www.kariyer.net//is-ilani/logo-yazilim-san-ve-tic-a-s-kidemli-yazilim-gelistirme-uzmani-3218141,https://img-kariyer.mncdn.com/UploadFiles/Clients/Logolar/3066.gif,data warehouse developer
Senior Software Developer (Web & Cybersecurity),Siemens,"engineering, management, coding, legal, electronics, research, software development, java, manufacturing",https://www.kariyer.net//is-ilani/siemens-senior-software-developer-web-cybersecurity-3492143,/_assets/img/firma-logosuz.png,software engineer
Senior Software Developer,Tatilsepeti.com,"design, scrum, sql, elasticsearch",https://www.kariyer.net//is-ilani/tatilsepeti-com-kidemli-yazilim-gelistirme-uzmani-3240888,https://img-kariyer.mncdn.com/UploadFiles/Clients/Logolar/5477_251688.jpg,data warehouse developer
"Senior Full Stack Software Developer (Java,...",Siemens,"engineering, management, apache, reviews, legal, research, building, software development, git, design, java, delivery",https://www.kariyer.net//is-ilani/siemens-senior-full-stack-software-developer-java-3496984,https://img-kariyer.mncdn.com/UploadFiles/Clients/Logolar/simko_logo.gif,software engineer
Senior ASP.NET Developer,Agito Bilgisayar Yazılım ve Danışmanlık Hizmetleri Anonim Şirketi,"css, html, oracle",https://www.kariyer.net//is-ilani/agito-bilgisayar-yazilim-ve-danismanlik-hizmetleri-kidemli-asp-net-yazilim-uzmani-3294221,https://img-kariyer.mncdn.com/UploadFiles/Clients/Logolar/7517_255141.jpg,front-end developer
Senior Software Developer,SOFT ROBOTİCS İNOVASYON YAZILIM VE DANIŞMANLIK ANONİM ŞİRKETİ,"restful, scrum, management, redis, elasticsearch, git, design, delivery, postgresql",https://www.kariyer.net//is-ilani/soft-robotics-inovasyon-yazilim-ve-danismanlik-ano-kidemli-yazilim-gelistirme-uzmani-3482879,https://img-kariyer.mncdn.com/UploadFiles/Clients/Logolar/280729_215727.jpg,data warehouse developer
Senior Software Developer,Logo Yazılım San Ve Tic A.Ş.,"mvc, bootstrap, html5, elasticsearch, design",https://www.kariyer.net//is-ilani/logo-yazilim-san-ve-tic-a-s-kidemli-yazilim-gelistirme-uzmani-3440327,https://img-kariyer.mncdn.com/UploadFiles/Clients/Logolar/3066.gif,front-end developer
Senior Software Developer (Web & PKI),Siemens,"scrum, engineering, coding, legal, electronics, research, software development, manufacturing",https://www.kariyer.net//is-ilani/siemens-senior-software-developer-web-pki-3469112,/_assets/img/firma-logosuz.png,software engineer
Senior Software Development Engineer,Siemens,"legal, manufacturing",https://www.kariyer.net//is-ilani/siemens-senior-software-development-engineer-3443864,/_assets/img/firma-logosuz.png,software engineer
PHP Software Developer,Garanti Barter AŞ,"json, mvc, restful, laravel, php, design, mysql",https://www.kariyer.net//is-ilani/garanti-barter-as-php-yazilim-gelistirme-uzmani-3490727,https://img-kariyer.mncdn.com/UploadFiles/Clients/Logolar/xnhjmbsb.ld0.png,data warehouse developer
PHP Software Developer,ECOTONE İSTANBUL BİLGİ İLETİŞİM HİZMETLERİ VE TİCARET LİMİTED ŞİRKETİ,"restful, laravel, php, big data, design, mysql, sql",https://www.kariyer.net//is-ilani/ecotone-istanbul-bilgi-iletisim-hizmetleri-ve-tica-php-yazilim-gelistirme-uzmani-3501062,https://img-kariyer.mncdn.com/UploadFiles/Clients/Logolar/204957_175828.jpg,data warehouse developer
PHP Software Developer,PAKET LOJİSTİK VE TEKNOLOJİ ANONİM ŞİRKETİ,"git, crm, php, mysql",https://www.kariyer.net//is-ilani/paket-lojistik-ve-teknoloji-anonim-sirketi-php-yazilim-gelistirme-uzmani-3451160,https://img-kariyer.mncdn.com/UploadFiles/Clients/Logolar/205328_202573.jpg,data warehouse developer
Leading Software Engineer,METEKSAN SAVUNMA SANAYİ A.Ş.,"git, design, java",https://www.kariyer.net//is-ilani/meteksan-savunma-sanayi-a-s-lider-yazilim-muhendisi-3505451,https://img-kariyer.mncdn.com/UploadFiles/Clients/Logolar/bilkentholding.jpg,data analyst
Junior Digital Workforce Engineer,NTT Data Business Solutions Türkiye,"management, html, sap, artificial intelligence, microsoft",https://www.kariyer.net//is-ilani/ntt-data-business-solutions-turkiye-junior-digital-workforce-engineer-3501831,https://img-kariyer.mncdn.com/UploadFiles/Clients/Logolar/4753_237391.jpg,front-end developer
Software Development Assistant Specialist,Zurich Sigorta A.Ş,"ajax, xml, html5, oracle, design, javascript",https://www.kariyer.net//is-ilani/zurich-sigorta-a-s-yazilim-gelistirme-uzman-yardimcisi-3467522,https://img-kariyer.mncdn.com/UploadFiles/Clients/Logolar/teb_sigorta.gif,front-end developer
Software Development Assistant Specialist,AVEKS İç ve Dış Tic.Aş.,"engineering, management, erp, technical support, insurance, research, software development, health",https://www.kariyer.net//is-ilani/aveks-ic-ve-dis-tic-as-software-development-assistant-specialist-3502163,https://img-kariyer.mncdn.com/UploadFiles/Clients/Logolar/18077_logo.gif,software support specialist
E-Commerce Software Developer,ÜÇKA TEKSTİL KONFEKSİYON İNŞAAT VE TİCARET A.Ş.,"erp, html, microsoft, css, javascript",https://www.kariyer.net//is-ilani/ucka-tekstil-konfeksiyon-insaat-ve-ticaret-a-s-e-commerce-software-developer-3154814,https://img-kariyer.mncdn.com/UploadFiles/Clients/Logolar/18936_logo.gif,front-end developer
Senior Hardware and Software Manager,Zebra Elektronik A.Ş.,"html5, linux, management",https://www.kariyer.net//is-ilani/zebra-elektronik-a-s-kidemli-donanim-ve-yazilim-yoneticisi-3506988,https://img-kariyer.mncdn.com/UploadFiles/Clients/Logolar/38972_209885.jpg,front-end developer
Java Software Engineer,Simsoft Bilgisayar Teknolojileri,java,https://www.kariyer.net//is-ilani/simsoft-bilgisayar-teknolojileri-java-yazilim-muhendisi-2888504,https://img-kariyer.mncdn.com/UploadFiles/Clients/Logolar/12217.gif,data analyst
Senior Java Software Engineer,Simsoft Bilgisayar Teknolojileri,java,https://www.kariyer.net//is-ilani/simsoft-bilgisayar-teknolojileri-kidemli-java-yazilim-muhendisi-2808952,https://img-kariyer.mncdn.com/UploadFiles/Clients/Logolar/12217.gif,data analyst
Java Software Engineer,TechnoHR Danışmanlık Hizm. Ltd. Şti.,"git, oracle, postgresql",https://www.kariyer.net//is-ilani/technohr-danismanlik-hizm-ltd-sti-java-yazilim-muhendisi-3491315,https://img-kariyer.mncdn.com/UploadFiles/Clients/Logolar/252364_209677.jpg,data warehouse developer
Java Software Engineer,Sektöründe Öncü Firma,"engineering, oauth, apache, redis, postgresql, git, design, java",https://www.kariyer.net//is-ilani/sektorunde-oncu-firma-java-yazilim-muhendisi-3507857,,data warehouse developer
Software Support and Project Specialist,HASTAVUK GIDA TARIMHAYVANCILIK SAN.VE TİC.A.Ş.,"erp, sap, sql",https://www.kariyer.net//is-ilani/hastavuk-gida-tarimhayvancilik-san-ve-tic-a-s-yazilim-destek-ve-proje-uzmani-3499995,https://img-kariyer.mncdn.com/UploadFiles/Clients/Logolar/17278_logo.gif,data warehouse developer
Web Development Specialist,Pratik Aday Servisi,"html, photoshop, css, illustrator, seo, javascript",https://www.kariyer.net//is-ilani/pratik-aday-servisi-web-gelistirme-uzmani-3508556,https://img-kariyer.mncdn.com/UploadFiles/Clients/Logolar/171866_188313.jpg,digital marketing specialist
Java Software Engineer,Sektöründe Öncü Firma,"engineering, oauth, apache, redis, postgresql, git, design, java",https://www.kariyer.net//is-ilani/sektorunde-oncu-firma-java-yazilim-muhendisi-3507857,,data warehouse developer
Senior Java Software Engineer,Huawei Telekomünikasyon Dış Tic. Ltd. Şti.,"linux, restful, python, engineering, web services, health, training, programming, insurance, redis, building, elasticsearch, plugin, design, java, research, software development, delivery",https://www.kariyer.net//is-ilani/huawei-telekomunikasyon-dis-tic-ltd-sti-senior-java-yazilim-muhendisi-3507747,https://img-kariyer.mncdn.com/UploadFiles/Clients/Logolar/huawei_logo.gif,software engineer
Java Developer,AMARIS TEKNOLOJİ İSTANBUL DANIŞMANLIK LTD.ŞTİ.,"courses, training, software development, elasticsearch, design, java",https://www.kariyer.net//is-ilani/amaris-teknoloji-istanbul-danismanlik-ltd-sti-java-developer-2820285,https://img-kariyer.mncdn.com/UploadFiles/Clients/Logolar/113135_193927log.png,software engineer
Java Developer,Sum Yazılım Bilgisayar Ltd . Şti .,"mvc, engineering, apache, iis, communications, design, java",https://www.kariyer.net//is-ilani/sum-yazilim-bilgisayar-ltd-sti-java-developer-3496614,/_assets/img/firma-logosuz.png,data analyst
Java Software Engineer,Solmaz Gümrük Müşavirliği A.Ş.,"algorithm, linux, scrum, engineering, management, mysql, cassandra, redis, software development, elasticsearch, git, design, java, debugging, sql",https://www.kariyer.net//is-ilani/solmaz-gumruk-musavirligi-a-s-java-yazilim-muhendisi-3072313,https://img-kariyer.mncdn.com/UploadFiles/Clients/Logolar/42663_148852.jpg,data warehouse developer
Experienced Software Engineer - Java,Siemens,"restful, engineering, legal, programming, electronics, software development, elasticsearch, git, design, java, c programming, debugging, manufacturing",https://www.kariyer.net//is-ilani/siemens-experienced-software-engineer-java-3407014,https://img-kariyer.mncdn.com/UploadFiles/Clients/Logolar/1017_247932.jpg,software engineer
Software Developer  Insider Testinium Tech Hub,Testinium,"finance, ecommerce, management, coding, programming, health, samsung, javascript, engineering, automotive, training, test automation, insurance, software development, reviews, css, ebay, laravel, php, html, linkedin, marketing, time management, sql",https://www.kariyer.net//is-ilani/testinium-software-developer-insider-testinium-tech-hub-2896485,https://img-kariyer.mncdn.com/UploadFiles/Clients/Logolar/62093_175146.jpg,data warehouse developer
Frontend Team Lead,Ekinoks Yazılım Ltd. Şti.,"html, git, html5, building, css, design, debugging, javascript",https://www.kariyer.net//is-ilani/ekinoks-yazilim-ltd-sti-frontend-team-lead-3342491,https://img-kariyer.mncdn.com/UploadFiles/Clients/Logolar/4vq5wams.nx0.png,front-end developer
Senior Front End Software Developer,Gizli Firma,"engineering, apache, postgresql, git, design",https://www.kariyer.net//is-ilani/gizli-firma-senior-front-end-software-developer-3302983,,data warehouse developer
Software Design Engineer,METEKSAN SAVUNMA SANAYİ A.Ş.,"linux, java",https://www.kariyer.net//is-ilani/meteksan-savunma-sanayi-a-s-yazilim-tasarim-muhendisi-3326716,https://img-kariyer.mncdn.com/UploadFiles/Clients/Logolar/7324_logo3.gif,data analyst
Frontend Developer,Gizli Firma,"restful, bootstrap, management, html, git, redis, css, seo, javascript",https://www.kariyer.net//is-ilani/gizli-firma-frontend-developer-3325196,,digital marketing specialist
Software Development Manager,Tatilsepeti.com,"restful, recruitment, scrum, engineering, ecommerce, management, agile development, coding, programming, redis, software development, elasticsearch, reviews, design, c programming",https://www.kariyer.net//is-ilani/tatilsepeti-com-software-development-manager-3496388,https://img-kariyer.mncdn.com/UploadFiles/Clients/Logolar/tatillogo.jpg,software engineer
Software Development Manager,Sendeo Dağıtım Hizmetleri Anonim Şirketi,"engineering, management, azure, communications, building, elasticsearch, research, design, software development, delivery, sql",https://www.kariyer.net//is-ilani/sendeo-dagitim-hizmetleri-anonim-sirketi-software-development-manager-3477901,https://img-kariyer.mncdn.com/UploadFiles/Clients/Logolar/260580_211324.jpg,data warehouse developer
Junior Software Developer,Aktur Araç Muayene İstasyonları İşletmeciliği A.Ş.,"mvc, sql",https://www.kariyer.net//is-ilani/aktur-arac-muayene-istasyonlari-isletmeciligi-a-s-junior-yazilim-gelistirme-uzmani-3507458,https://img-kariyer.mncdn.com/UploadFiles/Clients/Logolar/49891_logo.gif,data warehouse developer
General Application  Earthquake Employment Mobilization,LİNKTERA BİLGİ TEKNOLOJİLERİ A.Ş.,"project management, business analysis, data science, management",https://www.kariyer.net//is-ilani/linktera-bilgi-teknolojileri-a-s-genel-basvuru-deprem-istihdam-seferberligi-3379398,https://img-kariyer.mncdn.com/UploadFiles/Clients/Logolar/73669_1248851.png,it business analyst
Software Development Person,HEETSOFT BİLGİ TEKNOLOJİLERİ,"mvc, linq, git, software development, css, sql",https://www.kariyer.net//is-ilani/heetsoft-bilgi-teknolojileri-yazilim-gelistirme-elemani-3479173,https://img-kariyer.mncdn.com/UploadFiles/Clients/Logolar/244521_200351.jpg,data warehouse developer
Software Development Person,Sektöründe Öncü Firma,"mvc, restful, microsoft sql server, microsoft, sql",https://www.kariyer.net//is-ilani/sektorunde-oncu-firma-yazilim-gelistirme-elemani-3433076,,data warehouse developer
Full Stack Developer / IoT Software Developer,AppTec Services GmbH,"php, typescript, javascript",https://www.kariyer.net//is-ilani/apptec-services-gmbh-full-stack-developer-iot-yazilim-gelistirici-3504815,https://img-kariyer.mncdn.com/UploadFiles/Clients/Logolar/282818_216731.jpg,front-end developer
Senior Software Development Engineer,CRONOM BİLİŞİM VE YAZILIM TEKNOLOJİLERİ SAN.VE TİC. LTD. ŞTİ.,"linux, python, software development, building, design",https://www.kariyer.net//is-ilani/cronom-bilisim-ve-yazilim-teknolojileri-san-ve-tic-senior-software-development-engineer-3504979,/_assets/img/firma-logosuz.png,software engineer
Snr/Mid .Net Developer (Hybrid),Panates Bilgi Teknolojileri A.Ş.,"mvc, ajax, html, git, postgresql, css",https://www.kariyer.net//is-ilani/panates-bilgi-teknolojileri-a-s-snr-mid-net-developer-hybrid-3503989,https://img-kariyer.mncdn.com/UploadFiles/Clients/Logolar/23263_183750.jpg,data warehouse developer
Senior Software Developer / Java,İnnova Bilişim Çözümleri A.Ş.,"oracle, java, sql",https://www.kariyer.net//is-ilani/innova-bilisim-cozumleri-a-s-kidemli-yazilim-gelistirme-uzmani-java-3328200,https://img-kariyer.mncdn.com/UploadFiles/Clients/Logolar/1645_194693.jpg,data warehouse developer
Software Development Consultant / Java,İnnova Bilişim Çözümleri A.Ş.,"oracle, java, sql",https://www.kariyer.net//is-ilani/innova-bilisim-cozumleri-a-s-yazilim-gelistirme-danismani-java-3349402,https://img-kariyer.mncdn.com/UploadFiles/Clients/Logolar/1645_194693.jpg,data warehouse developer
Microservice Developer,ISCOM ELEKTRONİK DANIŞMANLIK VE BİLİŞİM HİZMETLERİ SAN TİC LTD ŞTİ,"json, xml, apache, programming, oracle, software development, design",https://www.kariyer.net//is-ilani/iscom-elektronik-danismanlik-ve-bilisim-hizmetleri-microservice-developer-3496842,/_assets/img/firma-logosuz.png,software engineer
SAP Hybris Java Developer,ENOCA BİLGİ TEKNOLOJİLERİ VE DANIŞMANLIKLTD.ŞTİ.,"ajax, ecommerce, j2ee, sap, java",https://www.kariyer.net//is-ilani/enoca-bilgi-teknolojileri-ve-danismanlikltd-sti-sap-hybris-java-developer-3423576,https://img-kariyer.mncdn.com/UploadFiles/Clients/Logolar/enoca.jpg,data analyst
Software Development Person,Huawei Telekomünikasyon Dış Tic. Ltd. Şti.,"java, sql",https://www.kariyer.net//is-ilani/huawei-telekomunikasyon-dis-tic-ltd-sti-yazilim-gelistirme-elemani-3492107,https://img-kariyer.mncdn.com/UploadFiles/Clients/Logolar/huawei_logo.gif,data warehouse developer
Software Developer For Industry 4.0,BOSCH REXROTH OTOMASYON SANAYİ VE TİCARET A.Ş.,"engineering, bootstrap, medical, mysql, technical support, azure, troubleshooting, programming, oracle, building, energy, software development, design, java, manufacturing",https://www.kariyer.net//is-ilani/bosch-rexroth-otomasyon-sanayi-ve-ticaret-a-s-software-developer-for-industry-4-0-3478943,https://img-kariyer.mncdn.com/UploadFiles/Clients/Logolar/boschisitma_logo.gif,it support technician
Software Development Person,PROTEM ELEKTRONIK MAKINA SAN. VE TIC. A.Ş.,"android, java",https://www.kariyer.net//is-ilani/protem-elektronik-makina-san-ve-tic-a-s-yazilim-gelistirme-elemani-3481469,https://img-kariyer.mncdn.com/UploadFiles/Clients/Logolar/10580_logo1.gif,mobile app developer
Web Software Intern,Bahçeci Sağlık Hizmetleri A.Ş.,"php, html, wordpress",https://www.kariyer.net//is-ilani/bahceci-saglik-hizmetleri-a-s-web-yazilim-stajyer-3153009,https://img-kariyer.mncdn.com/UploadFiles/Clients/Logolar/24039_logo.gif,front-end developer
Young Albarakatech,ALBARAKA TEKNOLOJİ BİLİŞİM SİSTEMLERİ VE PAZARLAMA TİCARET ANONİM ŞİRKETİ,sql,https://www.kariyer.net//is-ilani/albaraka-teknoloji-bilisim-sistemleri-ve-pazarlama-genc-albarakatech-3456762,https://img-kariyer.mncdn.com/UploadFiles/Clients/Logolar/295850_248625.jpg,data warehouse developer
Software Developer - Cobol,Omuz Omuza Engelsiz İnsan Kaynakları,"cobol, html5, programming, software development, design, sql",https://www.kariyer.net//is-ilani/omuz-omuza-engelsiz-insan-kaynaklari-software-developer-cobol-2181568,https://img-kariyer.mncdn.com/UploadFiles/Clients/Logolar/omuzomuza.gif,data warehouse developer
Junior Java Developer,VAKKO Tekstil ve Hazır Giyim San. İşl. A.Ş.,"design, iis, software development",https://www.kariyer.net//is-ilani/vakko-tekstil-ve-hazir-giyim-san-isl-a-s-junior-java-developer-3424653,https://img-kariyer.mncdn.com/UploadFiles/Clients/Logolar/vakko_logo.gif,software engineer
Mid/Sr. Software Engineer,TALENTHAUS TEKN. LTD. ŞTİ.,java,https://www.kariyer.net//is-ilani/talenthaus-tekn-ltd-sti-mid-sr-software-engineer-3490210,https://img-kariyer.mncdn.com/UploadFiles/Clients/Logolar/323000_245186.jpg,data analyst
Senior Backend Developer,BİTES Savunma Havacılık ve Uzay Teknolojileri A.Ş.,"python, engineering, programming, research, software development, design, java",https://www.kariyer.net//is-ilani/bites-savunma-havacilik-ve-uzay-teknolojileri-a-s-senior-backend-developer-3510387,/_assets/img/firma-logosuz.png,software engineer
Senior Java Software Engineer,SmartICT Bilişim A.Ş,"linux, mvc, python, scrum, ubuntu, oracle, postgresql, git, design, java, sql",https://www.kariyer.net//is-ilani/smartict-bilisim-a-s-kidemli-java-yazilim-muhendisi-3225579,https://img-kariyer.mncdn.com/UploadFiles/Clients/Logolar/smartıct.jpg,data warehouse developer
Senior Software Engineer,ELEKON ENERJİ SİSTEMLERİ SANAYİ VE TİCARET ANONİM ŞİRKETİ,"mqtt, postgresql, git, design, java, javascript",https://www.kariyer.net//is-ilani/elekon-enerji-sistemleri-sanayi-ve-ticaret-anonim-kidemli-yazilim-muhendisi-3501395,https://img-kariyer.mncdn.com/UploadFiles/Clients/Logolar/146730_1143381.png,data warehouse developer
