title,description,skill,link,img_url,label
Software Support Specialist/Assistant Specialist,Erdem Sağlık Grubu,"mac os, android, microsoft",https://www.kariyer.net//is-ilani/erdem-saglik-grubu-yazilim-destek-uzmani-uzman-yardimcisi-3177700,/_assets/img/firma-logosuz.png,software support and project specialist
Software Support Specialist (Kocaeli - İzmit),KEYDATA BİLGİ İŞLEM TEKNOLOJİ SİSTEMLERİ A.Ş.,sql,https://www.kariyer.net//is-ilani/keydata-bilgi-islem-teknoloji-sistemleri-a-s-yazilim-destek-uzmani-kocaeli-izmit-3333893,https://img-kariyer.mncdn.com/UploadFiles/Clients/Logolar/261870_246492.jpg,data warehouse developer
Software Support Specialist - İzmir,PROBEL YAZILIM VE BİLİŞİM SİSTEMLERİ A.Ş.,sql,https://www.kariyer.net//is-ilani/probel-yazilim-ve-bilisim-sistemleri-a-s-yazilim-destek-uzmani-izmir-3484739,https://img-kariyer.mncdn.com/UploadFiles/Clients/Logolar/probel_logo.gif,data warehouse developer
Software Support Specialist - Istanbul,PROBEL YAZILIM VE BİLİŞİM SİSTEMLERİ A.Ş.,sql,https://www.kariyer.net//is-ilani/probel-yazilim-ve-bilisim-sistemleri-a-s-yazilim-destek-uzmani-istanbul-3483142,https://img-kariyer.mncdn.com/UploadFiles/Clients/Logolar/probel_logo.gif,data warehouse developer
Software Development and Support Specialist,Vega Bilgisayar Hiz. Ltd. Şti.,"excel, sql",https://www.kariyer.net//is-ilani/vega-bilgisayar-hiz-ltd-sti-yazilim-gelistirme-ve-destek-uzmani-3467091,https://img-kariyer.mncdn.com/UploadFiles/Clients/Logolar/vegab_logo.gif,data warehouse developer
Software Support Specialist (Mis),Sampaş A.Ş.,oracle,https://www.kariyer.net//is-ilani/sampas-a-s-yazilim-destek-uzmani-mis-2876310,https://img-kariyer.mncdn.com/UploadFiles/Clients/Logolar/sampas_logo.gif,software support and project specialist
Web Developer,BİLİMEVİ EĞİTİM DANIŞMANLIK ANONİM ŞİRKETİ,"linux, bootstrap, php, html, css, wordpress, mysql, javascript",https://www.kariyer.net//is-ilani/bilimevi-egitim-danismanlik-anonim-sirketi-web-developer-3506754,https://img-kariyer.mncdn.com/UploadFiles/Clients/Logolar/20566_1119551.jpeg,data warehouse developer
Web Developer ( Full Stack Developer ),"BENTAŞ Bilgisayar, Endüstri, Mühendislik ve Ticare","scrum, asp, typescript, css, javascript",https://www.kariyer.net//is-ilani/bentas-bilgisayar-endustri-muhendislik-ve-ticare-web-yazilim-gelistirici-full-stack-developer-3507148,https://img-kariyer.mncdn.com/UploadFiles/Clients/Logolar/18447_logo.gif,front-end developer
Full Stack Developer,Ekinoks Yazılım Ltd. Şti.,"engineering, html, git, programming, insurance, redis, software development, health, css, design, java, javascript",https://www.kariyer.net//is-ilani/ekinoks-yazilim-ltd-sti-full-stack-developer-3388648,https://img-kariyer.mncdn.com/UploadFiles/Clients/Logolar/4vq5wams.nx0.png,front-end developer
Guı Web Developer,BUREAU VERITAS CPS TEST LABORATUVARLARI LTD. ŞTİ.,"css, mvc, html, javascript",https://www.kariyer.net//is-ilani/bureau-veritas-cps-test-laboratuvarlari-ltd-sti-gui-web-developer-3481518,https://img-kariyer.mncdn.com/UploadFiles/Clients/Logolar/mtl_logo.gif,front-end developer
Web Design and Content Specialist,EAE Elektrik Aydınlatma Endüstri San.ve Tic. A.Ş,"css, html, php, photoshop",https://www.kariyer.net//is-ilani/eae-elektrik-aydinlatma-endustri-san-ve-tic-a-s-web-tasarim-ve-icerik-uzmani-3504449,/_assets/img/firma-logosuz.png,front-end developer
Web Design and Social Media Specialist,Semercioğlu Gıda San. ve Tic. A.Ş.,"bootstrap, html, css, photoshop, after effects, illustrator",https://www.kariyer.net//is-ilani/semercioglu-gida-san-ve-tic-a-s-web-tasarim-ve-sosyal-medya-uzmani-3490428,https://img-kariyer.mncdn.com/UploadFiles/Clients/Logolar/semerci.gif,front-end developer
Software Support and Project Specialist,HASTAVUK GIDA TARIMHAYVANCILIK SAN.VE TİC.A.Ş.,"erp, sap, sql",https://www.kariyer.net//is-ilani/hastavuk-gida-tarimhayvancilik-san-ve-tic-a-s-yazilim-destek-ve-proje-uzmani-3499995,https://img-kariyer.mncdn.com/UploadFiles/Clients/Logolar/17278_logo.gif,data warehouse developer
Web Development Specialist,Pratik Aday Servisi,"html, photoshop, css, illustrator, seo, javascript",https://www.kariyer.net//is-ilani/pratik-aday-servisi-web-gelistirme-uzmani-3508556,https://img-kariyer.mncdn.com/UploadFiles/Clients/Logolar/171866_188313.jpg,digital marketing specialist
Web Design Specialist,Vertisa  Çevre Teknolojileri İnşaat Reklam. Dan.,"google adwords, php, html, marketing, photoshop, css, illustrator, seo",https://www.kariyer.net//is-ilani/vertisa-cevre-teknolojileri-insaat-reklam-dan-web-tasarim-uzmani-3391568,/_assets/img/firma-logosuz.png,digital marketing specialist
Web Design Specialist,Gizli Firma,"css, html, actionscript, photoshop",https://www.kariyer.net//is-ilani/gizli-firma-web-tasarim-uzmani-3508421,,front-end developer
Electrical Trade Engineer,Yeşilırmak Elektrik Perakende Satış A.Ş.,python,https://www.kariyer.net//is-ilani/yesilirmak-elektrik-perakende-satis-a-s-elektrik-ticaret-muhendisi-3393201,https://img-kariyer.mncdn.com/UploadFiles/Clients/Logolar/1590 yepas.gif,data analyst
Frontend Computer Engineer (React),SmartICT Bilişim A.Ş,"linux, scrum, ubuntu, azure, git, html5, css, java, javascript",https://www.kariyer.net//is-ilani/smartict-bilisim-a-s-frontend-onyuz-bilgisayar-muhendisi-react-2523349,https://img-kariyer.mncdn.com/UploadFiles/Clients/Logolar/smartıct.jpg,cloud solutions architect
Computer Scientist/Engineer,Sabanci Üniversitesi,"python, engineering, software architecture, matlab, research, design, cuda, java, manufacturing",https://www.kariyer.net//is-ilani/sabanci-universitesi-computer-scientist-engineer-3468618,https://img-kariyer.mncdn.com/UploadFiles/Clients/Logolar/sabanciuni_logo.gif,data analyst
Digital Banking Fullstack Developer,BURGAN BANK A.Ş.,"design, azure, redis",https://www.kariyer.net//is-ilani/burgan-bank-a-s-digital-banking-fullstack-developer-3373582,https://img-kariyer.mncdn.com/UploadFiles/Clients/Logolar/17959_logo.gif,cloud solutions architect
Backend Developer,BURGAN BANK A.Ş.,"design, biztalk, redis, postgresql",https://www.kariyer.net//is-ilani/burgan-bank-a-s-backend-developer-3421447,https://img-kariyer.mncdn.com/UploadFiles/Clients/Logolar/17959_logo.gif,data warehouse developer
System Administrator,VIKING INTERNATIONAL LTD.ŞTİ.,"windows server, veeam, microsoft, sql, vmware",https://www.kariyer.net//is-ilani/viking-international-ltd-sti-system-administrator-3403194,https://img-kariyer.mncdn.com/UploadFiles/Clients/Logolar/122712viking.gif,data warehouse developer
Computer engineer,Firma Bilgisi Gizli,"design, java",https://www.kariyer.net//is-ilani/firma-bilgisi-gizli-bilgisayar-muhendisi-3259546,,data analyst
Computer engineer,Neutec Bilişim Teknolojileri Tic. A.Ş.,"mvc, linq, microsoft, sql, javascript",https://www.kariyer.net//is-ilani/neutec-bilisim-teknolojileri-tic-a-s-bilgisayar-muhendisi-3390533,https://img-kariyer.mncdn.com/UploadFiles/Clients/Logolar/3341_logo20.gif,data warehouse developer
Computer Engineer/Android Developer,BEST MAKİNA SAN.TİC.A.Ş.,"json, mvc, restful, git, android, java",https://www.kariyer.net//is-ilani/best-makina-san-tic-a-s-bilgisayar-muhendisi-android-developer-3497269,https://img-kariyer.mncdn.com/UploadFiles/Clients/Logolar/139071_132645.jpg,mobile app developer
IoT Engineer,İstanbul Moda Akademisi,linux,https://www.kariyer.net//is-ilani/istanbul-moda-akademisi-iot-muhendisi-3413207,https://img-kariyer.mncdn.com/UploadFiles/Clients/Logolar/oyqjozss.b4a.png,data analyst
System and Network Assistant Specialist,Pronet Güvenlik Hizmetleri,"wireless, dns",https://www.kariyer.net//is-ilani/pronet-guvenlik-hizmetleri-sistem-ve-network-uzman-yardimcisi-3440320,https://img-kariyer.mncdn.com/UploadFiles/Clients/Logolar/pronet_logo.gif,data analyst
Computer engineer,Tele Medikal Yazılım ve Bilişim Tek.Ürn.san Tic.,"mvc, bootstrap, web services, html5, microsoft, sql, javascript",https://www.kariyer.net//is-ilani/tele-medikal-yazilim-ve-bilisim-tek-urn-san-tic-bilgisayar-muhendisi-3498212,/_assets/img/firma-logosuz.png,data warehouse developer
Computer engineer,ATARA MAKİNA OTOMASYON SAN. LTD. ŞTİ.,"json, mvc, html, xml, redis, css, sql, javascript",https://www.kariyer.net//is-ilani/atara-makina-otomasyon-san-ltd-sti-bilgisayar-muhendisi-3496156,https://img-kariyer.mncdn.com/UploadFiles/Clients/Logolar/23978_239819.jpg,data warehouse developer
Computer engineer,Ekoten Tekstil,"erp, sql",https://www.kariyer.net//is-ilani/ekoten-tekstil-bilgisayar-muhendisi-3495111,https://img-kariyer.mncdn.com/UploadFiles/Clients/Logolar/1452_204598.jpg,data warehouse developer
Web & Mobile User Experience Specialist,BİZE PROJE GELİŞTİRME A.Ş,"html, illustrator, photoshop, css, design, adobe indesign, javascript",https://www.kariyer.net//is-ilani/bize-proje-gelistirme-a-s-web-mobil-kullanici-deneyimi-uzmani-3475222,/_assets/img/firma-logosuz.png,front-end developer
Web Development Specialist,PALİKAR YAPI AKUSTİĞİ VE YALITIM SANAYİ TİCARET A,design,https://www.kariyer.net//is-ilani/palikar-yapi-akustigi-ve-yalitim-sanayi-ticaret-a-web-gelistirme-uzmani-3510131,https://img-kariyer.mncdn.com/UploadFiles/Clients/Logolar/uhmbtmee.tnd.png,full stack developer
Full-Stack Developer,MLP Sağlık Hizmetleri A.Ş.,"json, engineering, web services, training, delivery, oracle, building, postgresql, software development, design, java, sql, javascript",https://www.kariyer.net//is-ilani/mlp-saglik-hizmetleri-a-s-full-stack-developer-3479865,https://img-kariyer.mncdn.com/UploadFiles/Clients/Logolar/69967_241334.jpg,data warehouse developer
Computer engineer,ASLANLI İPLİK SAN.TİC.LTD.ŞTİ,sql,https://www.kariyer.net//is-ilani/aslanli-iplik-san-tic-ltd-sti-bilgisayar-muhendisi-3483670,/_assets/img/firma-logosuz.png,data warehouse developer
Computer engineer,Fortes Mühendislik Doğal Gaz İnşaat San. Ve Tic. A.Ş.,"sql, microsoft",https://www.kariyer.net//is-ilani/fortes-muhendislik-dogal-gaz-insaat-san-ve-tic-a-bilgisayar-muhendisi-3486541,https://img-kariyer.mncdn.com/UploadFiles/Clients/Logolar/36015_1277181.jpg,data warehouse developer
Web Development Specialist,Mewocon GmbH,"css, html, php, sql",https://www.kariyer.net//is-ilani/mewocon-gmbh-web-gelistirme-uzmani-3494241,/_assets/img/firma-logosuz.png,data warehouse developer
Web Development Specialist,Nsm emlak,"php, seo, freelance, word",https://www.kariyer.net//is-ilani/nsm-emlak-web-gelistirme-uzmani-3500652,/_assets/img/firma-logosuz.png,digital marketing specialist
QA Automation Engineer (Disabled),Getir Perakende Lojistik A.Ş.,"swift, python, programming, typescript, java, javascript",https://www.kariyer.net//is-ilani/getir-perakende-lojistik-a-s-qa-otomasyon-muhendisi-engelli-3482819,https://img-kariyer.mncdn.com/UploadFiles/Clients/Logolar/151581_1199051.jpg,front-end developer
Wordpress Expert - Paris Saint-Germain Academy,AİCOSPORTS EĞİTİM DANIŞMANLIK VE TURİZM HİZMETLERİ A.Ş.,"analytics, bootstrap, php, html, google analytics, css, wordpress, seo, javascript",https://www.kariyer.net//is-ilani/aicosports-egitim-danismanlik-ve-turizm-hizmetleri-word-press-uzmani-paris-saint-germain-academy-3505859,/_assets/img/firma-logosuz.png,digital marketing specialist
Computer engineer,Elmaksan Makina Sanayi,"metro, sql",https://www.kariyer.net//is-ilani/elmaksan-makina-sanayi-bilgisayar-muhendisi-3405182,https://img-kariyer.mncdn.com/UploadFiles/Clients/Logolar/elmaksan_logo.gif,data warehouse developer
Front End Web Developer,ESTEWORLD SAÇ EKİMİ VE PLASTİK CERRAHİ SAĞLIK GRUBU,"website design, html, branding, typography, scheme, cms, photography, css, design, wordpress, seo, javascript",https://www.kariyer.net//is-ilani/esteworld-sac-ekimi-ve-plastik-cerrahi-saglik-grub-front-end-web-developer-3494340,/_assets/img/firma-logosuz.png,digital marketing specialist
System and Hardware Specialist,BOR HOLDİNG ANONİM ŞİRKETİ,"active directory, dns, helpdesk, microsoft",https://www.kariyer.net//is-ilani/bor-holding-anonim-sirketi-sistem-ve-donanim-uzmani-3479065,https://img-kariyer.mncdn.com/UploadFiles/Clients/Logolar/2_borholding_150x40.jpg,data analyst
Web Development Specialist,BALCIOĞLU GRUP STANDART İZOLASYON VE YAPI MATERYALLERİ SAN.TİC.A.Ş,"python, ecommerce, php, html, git, django, photoshop, css, javascript",https://www.kariyer.net//is-ilani/balcioglu-grup-standart-izolasyon-ve-yapi-materyal-web-gelistirme-uzmani-3433045,https://img-kariyer.mncdn.com/UploadFiles/Clients/Logolar/9117_1124511 (1).jpg,front-end developer
Web Developer,erc estetik sağlık turizm ltd şti,"analytics, web services, amazon web services, php, html, azure, photoshop, seo, microsoft, css, wordpress, mysql",https://www.kariyer.net//is-ilani/erc-estetik-saglik-turizm-ltd-sti-web-developer-3180566,https://img-kariyer.mncdn.com/UploadFiles/Clients/Logolar/drcınık.png,data warehouse developer
Web Applications Development Specialist,İstanbul Bilgi Üniversitesi,"linux, python, apache, django, nginx, git, mysql, postgresql",https://www.kariyer.net//is-ilani/istanbul-bilgi-universitesi-web-uygulamalari-gelistirme-sorumlusu-3247424,https://img-kariyer.mncdn.com/UploadFiles/Clients/Logolar/23849_logo.gif,data warehouse developer
Web Expert,Sonasya tekstil,"wordpress, woocommerce, youtube, instagram, photoshop, crm, illustrator, seo",https://www.kariyer.net//is-ilani/sonasya-tekstil-web-uzmani-3480066,https://img-kariyer.mncdn.com/UploadFiles/Clients/Logolar/49840_1268191.jpg,digital marketing specialist
Software Support Person,AIFA GLOBAL BİLİŞİM HİZMETLERİ LİMİTED ŞİRKETİ,sql,https://www.kariyer.net//is-ilani/aifa-global-bilisim-hizmetleri-limited-sirketi-yazilim-destek-elemani-3500676,https://img-kariyer.mncdn.com/UploadFiles/Clients/Logolar/156555_160995.jpg,data warehouse developer
Software Support Staff,Duru Bilişim Teknolojileri Ltd. Şti.,"iis, postgresql",https://www.kariyer.net//is-ilani/duru-bilisim-teknolojileri-ltd-sti-yazilim-destek-elemanlari-3493647,https://img-kariyer.mncdn.com/UploadFiles/Clients/Logolar/173852_135150.jpg,data warehouse developer
Software Support Person,LOKMAN HEKİM ENGÜRÜSAĞ SAĞLIK TUR.EĞİ.HİZ.VE İNŞ.TAAH.A.Ş.,sql,https://www.kariyer.net//is-ilani/lokman-hekim-engurusag-saglik-tur-egi-hiz-ve-ins-t-yazilim-destek-elemani-3494868,https://img-kariyer.mncdn.com/UploadFiles/Clients/Logolar/lokmanhe_logo.gif,data warehouse developer
Software Support Person,POSCUBE DONANIM YAZILIM ve DANIŞMANLIK LTD.ŞTİ.,microsoft,https://www.kariyer.net//is-ilani/poscube-donanim-yazilim-ve-danismanlik-ltd-sti-yazilim-destek-elemani-2848769,/_assets/img/firma-logosuz.png,software support and project specialist
Software Support Person,Utarit Bilişim Hizmetleri Sanayi ve Ticaret .A.ş,"sql, microsoft",https://www.kariyer.net//is-ilani/utarit-bilisim-hizmetleri-sanayi-ve-ticaret-a-s-yazilim-destek-elemani-3479693,https://img-kariyer.mncdn.com/UploadFiles/Clients/Logolar/utaritlogo.gif,data warehouse developer
Game Developer,PANTEON OYUN TEKNOLOJILERI,"unity 3d, engineering, management, health, youtube, coding, game design, programming, insurance, energy, design, game development",https://www.kariyer.net//is-ilani/panteon-oyun-teknolojileri-game-developer-3509149,https://img-kariyer.mncdn.com/UploadFiles/Clients/Logolar/38854_logo1.gif,game developer
Environment Artist,DOF,"robotics, engineering",https://www.kariyer.net//is-ilani/dof-environment-artist-2643592,https://img-kariyer.mncdn.com/UploadFiles/Clients/Logolar/srrp42dw.4xx.jpg,robotics engineer
Senior Frontend Trainer,Bilge Adam,"css, html, javascript",https://www.kariyer.net//is-ilani/bilge-adam-senior-frontend-trainer-3467000,/_assets/img/firma-logosuz.png,front-end developer
Application Development and Business Intelligence Specialist,KALE PRATT&WHITNEY UÇAK MOTOR SAN.A.Ş.,erp,https://www.kariyer.net//is-ilani/kale-pratt-whitney-ucak-motor-san-a-s-uygulama-gelistirme-ve-is-zekasi-uzmani-3057035,https://img-kariyer.mncdn.com/UploadFiles/Clients/Logolar/50118_logo.gif,business intelligence analyst
Odoo Developer,EBG Bilişim Teknolojileri ve Hizmetleri A.Ş.,"linux, python, odoo, postgresql, javascript",https://www.kariyer.net//is-ilani/ebg-bilisim-teknolojileri-ve-hizmetleri-a-s-odoo-gelistirici-3412751,https://img-kariyer.mncdn.com/UploadFiles/Clients/Logolar/31064_logo.gif,data warehouse developer
Application Administration Specialist,Koç Üniversitesi,"excel, powerpoint, management, advertising, html, coding, microsoft office, microsoft, project management, design, delivery",https://www.kariyer.net//is-ilani/koc-universitesi-application-administration-specialist-3448393,https://img-kariyer.mncdn.com/UploadFiles/Clients/Logolar/ku_logo.gif,front-end developer
Fullstack PHP Developer,Pratik Aday Servisi,"php, erp, html, css, javascript",https://www.kariyer.net//is-ilani/pratik-aday-servisi-fullstack-php-yazilim-uzmani-3508552,https://img-kariyer.mncdn.com/UploadFiles/Clients/Logolar/171866_188313.jpg,front-end developer
Software Support and Project Specialist,HASTAVUK GIDA TARIMHAYVANCILIK SAN.VE TİC.A.Ş.,"erp, sap, sql",https://www.kariyer.net//is-ilani/hastavuk-gida-tarimhayvancilik-san-ve-tic-a-s-yazilim-destek-ve-proje-uzmani-3499995,https://img-kariyer.mncdn.com/UploadFiles/Clients/Logolar/17278_logo.gif,data warehouse developer
Onsite Linux Support Specialist,CLEAN TEMİZLİK VE DANIŞMANLIK HİZMETLERİANONİM ŞİRKETİ,"linux, perl, ubuntu, active directory, oracle, microsoft, vmware",https://www.kariyer.net//is-ilani/clean-temizlik-ve-danismanlik-hizmetlerianonim-sir-onsite-linux-destek-uzmani-3332898,https://img-kariyer.mncdn.com/UploadFiles/Clients/Logolar/5616_logo.gif,data analyst
Technology Systems Manager,ASAŞ ALÜMİNYUM SAN.VE TİC.A.Ş.,sql,https://www.kariyer.net//is-ilani/asas-aluminyum-san-ve-tic-a-s-teknoloji-sistemleri-yoneticisi-3352957,https://img-kariyer.mncdn.com/UploadFiles/Clients/Logolar/2245_251414.jpg,data warehouse developer
Technology Manager,AYHAN TEKNOLOJİ ve OTOMASYON ÇÖZÜMLERİ A.Ş.,"crm, autocad",https://www.kariyer.net//is-ilani/ayhan-teknoloji-ve-otomasyon-cozumleri-a-s-teknoloji-yoneticisi-3486219,https://img-kariyer.mncdn.com/UploadFiles/Clients/Logolar/310606_238520.jpg,data analyst
SAP ABAP Consultant,AYTEMİZ AKARYAKIT DAĞITIM ANONİM ŞİRKETİ,sap,https://www.kariyer.net//is-ilani/aytemiz-akaryakit-dagitim-anonim-sirketi-sap-abap-danismani-3510297,https://img-kariyer.mncdn.com/UploadFiles/Clients/Logolar/uztgbzte.l33.jpg,
SAP ABAP Consultant,NTT Data Business Solutions Türkiye,"sap, microsoft",https://www.kariyer.net//is-ilani/ntt-data-business-solutions-turkiye-sap-abap-danismani-3282506,https://img-kariyer.mncdn.com/UploadFiles/Clients/Logolar/4753_237391.jpg,data analyst
IT Technical Support Specialist,Secret Bilgisayar Ltd Şti,"windows server, dns, sql, microsoft",https://www.kariyer.net//is-ilani/secret-bilgisayar-ltd-sti-bilgi-islem-teknik-destek-sorumlusu-2808954,https://img-kariyer.mncdn.com/UploadFiles/Clients/Logolar/8578_194601.jpg,data warehouse developer
Information Security Specialist,Darüşşafaka Cemiyeti,"azure, windows server, active directory, iis, dns, sql",https://www.kariyer.net//is-ilani/darussafaka-cemiyeti-bilgi-guvenligi-uzmani-3268639,https://img-kariyer.mncdn.com/UploadFiles/Clients/Logolar/34075_252352.jpg,data warehouse developer
Field Operations Team Member,Kuzey Kıbrıs Turkcell,"excel, powerpoint, word",https://www.kariyer.net//is-ilani/kuzey-kibris-turkcell-saha-operasyon-takim-uyesi-3226475,https://img-kariyer.mncdn.com/UploadFiles/Clients/Logolar/1_trkcll-logo-150x40.png,data analyst
Information Technologies Office Officer,Koç Üniversitesi Hastanesi,"excel, powerpoint, word",https://www.kariyer.net//is-ilani/koc-universitesi-hastanesi-bilgi-teknolojileri-ofis-gorevlisi-3478785,/_assets/img/firma-logosuz.png,data analyst
Information Technologies /It Staff,Sporpark Ayakkabı Tekstil ve Spor Malzm.,"vmware, microsoft",https://www.kariyer.net//is-ilani/sporpark-ayakkabi-tekstil-ve-spor-malzm-bilgi-teknolojileri-it-elamani-3483532,/_assets/img/firma-logosuz.png,data analyst
Embedded Systems Software Development Specialist,Seyir Mobil Yazılım Elektronik Otomasyon Sistemler,"git, linux, gps",https://www.kariyer.net//is-ilani/seyir-mobil-yazilim-elektronik-otomasyon-sistemler-gomulu-sistemler-yazilim-gelistirme-uzmani-3495891,https://img-kariyer.mncdn.com/UploadFiles/Clients/Logolar/51585_logo.gif,embedded software engineer
Embedded Software Engineer - Motor Control,WAT MOTOR SANAYİ VE TİCARET ANONİM ŞİRKETİ,"engineering, german, management, technical support, moving, personal development, matlab, programming, shopping, electrical engineering, electronics, mechatronics, design, c programming, debugging, embedded software",https://www.kariyer.net//is-ilani/wat-motor-sanayi-ve-ticaret-anonim-sirketi-embedded-software-engineer-motor-control-3361879,https://img-kariyer.mncdn.com/UploadFiles/Clients/Logolar/328765_247703.jpg,software support specialist
Embedded Software Specialist,CANTEK SOĞUTMA A.Ş.,rtos,https://www.kariyer.net//is-ilani/cantek-sogutma-a-s-gomulu-yazilim-uzmani-3474194,https://img-kariyer.mncdn.com/UploadFiles/Clients/Logolar/13066cantek.gif,data analyst
SAP ABAP Specialist,Sarkuysan A.Ş.,sap,https://www.kariyer.net//is-ilani/sarkuysan-a-s-sap-abap-uzmani-3495037,https://img-kariyer.mncdn.com/UploadFiles/Clients/Logolar/sarkuysan_logo.gif,
SAP ABAP Software Developer,Gizli Firma,sap,https://www.kariyer.net//is-ilani/gizli-firma-sap-abap-yazilim-gelistirme-uzmani-3118547,,data analyst
SAP ABAP Specialist,Yıldızlar Yatırım Holding A.Ş.,sap,https://www.kariyer.net//is-ilani/yildizlar-yatirim-holding-a-s-sap-abap-uzmani-2967253,https://img-kariyer.mncdn.com/UploadFiles/Clients/Logolar/11704_250986.jpg,
SAP ABAP Senior Software Specialist,Aromsa Besin Aroma Ve Katkı Maddeleri,"sap, javascript",https://www.kariyer.net//is-ilani/aromsa-besin-aroma-ve-katki-maddeleri-sap-abap-kidemli-yazilim-uzmani-3370425,https://img-kariyer.mncdn.com/UploadFiles/Clients/Logolar/20916_254029.jpg,front-end developer
SAP ABAP Specialist,GÖLTAŞ GÖLLER BÖLGESİ ÇİMENTO SAN.VE TİC.A.Ş.,sap,https://www.kariyer.net//is-ilani/goltas-goller-bolgesi-cimento-san-ve-tic-a-s-sap-abap-uzmani-3509388,https://img-kariyer.mncdn.com/UploadFiles/Clients/Logolar/goltas-5112020.jpg,
Draftsman,Mikropor Makina San. Tic. A.Ş.,"autocad, autodesk inventor",https://www.kariyer.net//is-ilani/mikropor-makina-san-tic-a-s-teknik-ressam-3357826,https://img-kariyer.mncdn.com/UploadFiles/Clients/Logolar/14721.gif,data analyst
SAP ABAP Specialist,EKU FREN VE DÖKÜM SANAYİ A.Ş.,"programming, sap",https://www.kariyer.net//is-ilani/eku-fren-ve-dokum-sanayi-a-s-sap-abap-uzmani-2270787,https://img-kariyer.mncdn.com/UploadFiles/Clients/Logolar/1242_252571.jpg,software engineer
SAP ABAP Specialist,ERBAKIR ELEKTROLİTİK BAKIR MAMÜLLERİ A.Ş.,sap,https://www.kariyer.net//is-ilani/erbakir-elektrolitik-bakir-mamulleri-a-s-sap-abap-uzmani-3500488,https://img-kariyer.mncdn.com/UploadFiles/Clients/Logolar/173643_217378.jpg,
Software Testing and Quality Specialist,Gizli Firma,"iis, sql",https://www.kariyer.net//is-ilani/gizli-firma-yazilim-test-ve-kalite-uzmani-3508414,,data warehouse developer
React Native Developer (Remote),Domino's Pizza,"leads, scrum, engineering, ecommerce, moving, turkish, typescript, git, history, android, delivery, javascript",https://www.kariyer.net//is-ilani/domino-s-pizza-react-native-developer-remote-3488692,/_assets/img/firma-logosuz.png,front-end developer
Mobile Application Developer,BİZE PROJE GELİŞTİRME A.Ş,"json, restful, swift, azure, android, dart",https://www.kariyer.net//is-ilani/bize-proje-gelistirme-a-s-mobil-uygulama-gelistiricisi-3474570,/_assets/img/firma-logosuz.png,cloud solutions architect
Mobile Developer,LEDBİM BİLİŞİM DANIŞMANLIK VE TİCARET ANONİM ŞİRKETİ,"restful, design, pdf, hive",https://www.kariyer.net//is-ilani/ledbim-bilisim-danismanlik-ve-ticaret-anonim-sirke-mobile-developer-3314750,https://img-kariyer.mncdn.com/UploadFiles/Clients/Logolar/nxv54jr0.bgo.jpg,data analyst
Junior Mobile Application Developer,Limak Yatırım Enerji Ürt. İşl. Hiz. ve İnş. A.Ş.,"recruitment, swift, management, health, insurance, research, software development, android, git, design, dart",https://www.kariyer.net//is-ilani/limak-yatirim-enerji-urt-isl-hiz-ve-ins-a-s-junior-mobile-application-developer-3490668,https://img-kariyer.mncdn.com/UploadFiles/Clients/Logolar/limak_logo.gif,mobile app developer
Mobile Application Developer,Biges Güvenli Hayat Teknolojileri A.Ş.,"git, restful, javascript",https://www.kariyer.net//is-ilani/biges-guvenli-hayat-teknolojileri-a-s-mobil-uygulama-gelistiricisi-3507209,https://img-kariyer.mncdn.com/UploadFiles/Clients/Logolar/biges.gif,front-end developer
Mobile Applications Team Leader,Seyir Mobil Yazılım Elektronik Otomasyon Sistemler,android,https://www.kariyer.net//is-ilani/seyir-mobil-yazilim-elektronik-otomasyon-sistemler-mobil-uygulamalar-takim-lideri-3483916,https://img-kariyer.mncdn.com/UploadFiles/Clients/Logolar/51585_logo.gif,mobile app developer
Mobile Application Developer,İPEKYOLU KUYUMCULUK KIYMETLİ TAŞLAR TURİZM OTELCİLİK SANAYİ VE TİCARET LTD.ŞTİ.,"git, android",https://www.kariyer.net//is-ilani/ipekyolu-kuyumculuk-kiymetli-taslar-turizm-otelcil-mobil-uygulama-gelistiricisi-3508624,https://img-kariyer.mncdn.com/UploadFiles/Clients/Logolar/170444_218310.jpg,mobile app developer
Android Application Development Specialist,Gizli Firma,"json, android, java",https://www.kariyer.net//is-ilani/gizli-firma-android-uygulama-gelistirme-uzmani-3359859,,mobile app developer
